{
  "$schema": "https://json-schema.org/draft/2020-12/schema",
  "$id": "sciforge/schemas/PROOF_AUDIT.schema.json",
  "title": "PROOF_AUDIT.json - step-by-step derivation proof verification",
  "description": "Produced by /theory-derivation (step-by-step proof verification) per artifact-registry.md. Shape follows the Required Audit Artifact Schema in shared-references/assurance-contract.md (the skill defines no narrower one). audited_input_hashes is mandatory per artifact-registry.md schema invariant 2.",
  "type": "object",
  "required": [
    "audit_skill",
    "verdict",
    "reason_code",
    "summary",
    "audited_input_hashes",
    "trace_path",
    "reviewer_model",
    "reviewer_reasoning",
    "generated_at",
    "details"
  ],
  "properties": {
    "audit_skill": {
      "type": "string",
      "description": "Producer skill name, e.g. theory-derivation."
    },
    "verdict": {
      "type": "string",
      "enum": ["PASS", "WARN", "FAIL", "NOT_APPLICABLE", "BLOCKED", "ERROR"],
      "description": "6-state vocabulary per assurance-contract.md."
    },
    "reason_code": {
      "type": "string"
    },
    "summary": {
      "type": "string",
      "description": "One-line human-readable summary."
    },
    "audited_input_hashes": {
      "type": "object",
      "description": "SHA256 of every file the audit consumed (filename -> sha256). Verifier rehashes and flags STALE on mismatch.",
      "additionalProperties": {
        "type": "string",
        "pattern": "^(sha256:)?[0-9a-fA-F]{64}$"
      }
    },
    "trace_path": {
      "type": "string",
      "description": "Directory containing the full reviewer prompt + response pair (required for mandatory audits)."
    },
    "thread_id": {
      "type": "string",
      "description": "Reviewer provider thread ID. Optional: assurance-contract lists it in the minimum block but OSS is single-agent and the kill-argument sample omits it."
    },
    "reviewer_model": {
      "type": "string"
    },
    "reviewer_reasoning": {
      "type": "string"
    },
    "generated_at": {
      "type": "string",
      "pattern": "^[0-9]{4}-[0-9]{2}-[0-9]{2}T[0-9]{2}:[0-9]{2}:[0-9]{2}(\\.[0-9]+)?(Z|[+-][0-9]{2}:[0-9]{2})?$",
      "description": "UTC ISO-8601 timestamp."
    },
    "details": {
      "type": "object",
      "description": "Audit-specific detail payload (per-step verification results)."
    }
  },
  "additionalProperties": true
}
